username,tweetsevencol0rs,"Loss of motivation has to be a Covid symptom, I ain’t feel the same since March 2020"
AlertsHotspur,LATEST: Spurs face six positive Covid-19 results amid possible outbreak - reports #THFC https://t.co/zTagbrudS3
claronhealth,"Searching for a diagnostic center, specially curated to suit your medical needs?Book an appointment with the diagnostic center at Claron Health international today.Call us on 0506777300 / 0302771017.#claronhealth #claronDoc#claroncares #Diagnostic #Ultrasound  #Covid_19 https://t.co/y75qjYrq5f"
davidlimesalt,How interesting for you Adam. My mother caught covid and died. https://t.co/5GlOWCBBbc
watinthe_,Air filters on Addenbrooke’s wards ‘removed nearly all traces of airborne Covid-19 virus’ https://t.co/A1zRVtVqgw
send2gl,"Vaccines (gene therapy) are trashing the immune system.Cold and Flu are making the jabbed extremely ill.People feel extremely ill, so, get a booster, mistakenly believing it'll make them feel better.PCR tests colds and flues as positive for Covid-19.A perfect storm!!!!"
SheelaghG,"FYI, I'm quoted here (with @yaelselfin and @becksv8) sounding gloomy on the economic impact of further Covid restrictions... (Fortunately I don't these will be necessary, because the #Omicron scare should pass soon)https://t.co/ZxwtEA92EB"
JohnNeophytou,@ajcdeane I think some people are panicking unnecessarily. 👇https://t.co/t9olLsTcY6
toren713,"on my back of envelope math, Fox News viewers have more than a 2 times higher likelihood of dying from COVID in last six months than viewers of MSNBC, CNN.  This shows one of the dangers of misinformation."
chappersbrum,Petition: Fast-track rollout of Covid vaccine in 5-11s post MHRA approval https://t.co/ijeBK9AOCs
dragon14fly,Top Republican investigators demanded answers Monday from the Biden administration about how taxpayer money meant to go to unemployed Americans during the coronavirus pandemic has instead been stolen by Chinese or Russian syndicates.https://t.co/ouM2Y9rFV8
TagzCrypto,Would you support extending Covid passes to pubs and restaurants in Wales if the measure is announced at the next Welsh Government review on Friday?
Twitspice,"@Mick_Lindores @AmeliaRocket1 @johnredwood Maybe ask how many died from Covid while your about it. Our daughter was an nhs doctor so I have knowledge of this,oh and yes they lost a lot of staff due to brexit as many don’t qualify for work visas.Cleaners/porters etc,many left because they were made to feel so unwelcome."
Muller_Matambo,"This thing going around is not just a Flu, it's covid. Don't expose your friends by being stubborn and attending machills with them. https://t.co/FgI2BIWvnr"
SAG72_,"#سب_ٹھیک_کرے_گا_کپتانInflation is not only problem of Pakistan but the whole world.Despite of Covid Crises The situation is still better because of Imran Khan's best policies in PakistanThis is not the time to be a tool of opposition, this is the time to support @ImranKhanPTI https://t.co/dSYvoxj2hv"
JimAnde19834086,Joe Rogan calls out @LinkedIn for deleting a post by a Medical Doctor who posted a peer reviewed scientific study that shows vitamin D significantly lowered Covid hospitalizations. Big Tech &amp; Big Pharma oligarchs don’t want you to have life saving info https://t.co/bpEDpZq2YR
Debbee75,"COVID-19 Vaccines do Not Stop Transmission of COVID, but Instead Increase it https://t.co/13KrSGakVd"
PJDunleavy,"Why austerity may be making a post-COVID comeback – in Britain, at least | LSE COVID-19 https://t.co/LTWPOzpkEz"
Teresa18454072,"Anthony Fauci's response to Covid was the same response he had for AIDS, he ignored early treatments that work in favor for vaccines that don't."
LStansbury,"@l4jt @JoePorterUK @BorisJohnson Is it the corruption, the sewage in our waterways, the bungs to their mates &amp; donors, the Covid death toll, taxing of the low &amp; middle earners while considering tax cuts for higher earners that do it for you, or do you just enjoy being lied to? What’s the draw, genuinely curious"
BenjiSeitlhamo,"The South African Medical Association is advising people to get tested for COVID-19, even if they have mild flu-like symptoms. It says there's a very thin line between the flu and the #Omicronvariant. #DStv403 #eNCA https://t.co/wrmSWN3jkP"
BobMoor33020935,British Health Secretary Sajid Javid confirms that none who have tested positive for the Omicron variant of Covid-19 in the UK have been hospitalised.
Ann11621042,"@LauraJoint @BBCRosAtkins I'll second that. Please tell the public how they are trying to dismantle the laws that protect our democracy, the fraud in covid contracts wasting billions of taxpayers money etc., saying ministers can ignore court rulings if they do not like them. Wake up  the British public."
SvenRadio,Tomorrow the Health and Care Bill 2021 goes into HoL. Covid is a cover for dismantling health care. There has been no meaningful opposition from Labour front bench @Keir_Starmer or from @bma or from Royal Colleges. Time to oppose bill before it’s too late.
carlsl,RIP🙏 North Western Province Governor Raja Kollure (83) has passed away while receiving treatment in hospital after testing positive for Covid - Hiru #SriLanka #LKA #RIP https://t.co/a98mPMqSBn
Youngnogg,"Victorian Premier Daniel Andrews is facing criticism after a ruling found state border rules between July and September to be “unjust” and in several cases, “inhumane”. https://t.co/LAXJ6LhR99"
Hiroshimalily,"@Andy_g1979 @paul_stothard Covid exists and we are still in a pandemic. The government is corrupt and gives contracts for testing to friends and donors.Those two things can both be true at the same time, they’re not mutually exclusive."
Justsay42740408,"The National Economic Development and Labour Council (Nedlac) has thrown its support behind restricting public gatherings to vaccinated persons, and businesses only allowing vaccinated employees to access their place of work.https://t.co/hfbcGy0sBG via @fin24"
NancyKlapak,"So the MAGAs started with bleach, and putting lightbulbs up their butt. They moved on to Hydroxychloroquine. Then it was horse paste, and now it's dirt with heavy metals??  Horrifying! Jeez, if only there was a safe, effective vaccine for Covid that was free.  Oh wait😳🤪🙄"
grfoe,Reminder: From 6:30PM today join our Consular colleagues for a LIVE discussion on all things visas and COVID-19 vaccine travel information. #TwitterSpaces #TravelReady  https://t.co/ZxQO8OvEsZ
lornarichardson,"After soul searching, I've pushed back the submission date for contributors to the Routledge Handbook of Archaeology &amp; Media to summer 2022. People are stressed, ill, tired, grieving, juggling kids/parental care etc. A lot of contributors are in places where Covid is super-rife"
RealityFirst3,Ministers must rebuke crazed Covid zealots https://t.co/HEcQLg3nbG
FPL_Ross,What Tottenham must do to get Brighton Premier League game postponed amid Covid outbreak https://t.co/LBJ93Xysg9 #THFC #COYS
OkBloomer7,"If you want to talk about freedom, let’s talk about the freedom not to be infected on the basis of other people’s choices.Mask mandates in indoor public spaces while covid is spreading actually increase freedom for many people."
ifeoluwakishi_o,@RueCarti there’s a new covid variant
4nkz,"@Paratus2014 @BigDaddyLiberty There are entitled and privileged people living large in this country that have no idea what can happen, and how quickly, when you provide the right spark to a desperate and gatvol Population. Poverty and unemployment is a crisis. Covid is a worry for the middle and upper class."
BashorunGha,https://t.co/W6TUqMQuiaThe metal was developed to combat virus transmission via surface touching in public areas.
INNOMEDELZITTI,let’s make Year Three of Covid the best one yet!!
shahin51945230,"@SniktWifey let's start a vitamin D campaign to stop heart attack &amp; stroke in winter.""Higher vitamin D levels in body greatly reduce risk of cancer, cardiovascular disease, diabetes, hypertension, autoimmune diseases, infectious diseases, and COVID-19"".Dr William B Grant PhD @wbgrant2"
Bennett1Ryan,"You must wear a face covering throughout your journey, unless you’re exempt. Please continue to wash and sanitise your hands regularly, give space to others and pay by contactless, if you can. Find out more about travelling safely &gt; https://t.co/nTMkJADspM https://t.co/YXP9O3OTLP"
Quiet__Please,How interesting for you Adam. My mother caught covid and died. https://t.co/5GlOWCBBbc
inlondon2015,Tottenham's plans for the Europa Conference League tie with Rennes are in chaos and they could apply for the PL game v Brighton to be postponed following a significant Covid outbreak at the club #thfc https://t.co/53hLsn2WZx
ingridgrenar,New Zealand's Covid Response has so far resulted in the lowest number of Covid cases per capita out of all 38 OECD countries  New Zealand Media - *crickets
trasherz_,"Loss of motivation has to be a Covid symptom, I ain’t feel the same since March 2020"
WilfriedFonteyn,@PaddyLowe81 @NiHaolain @DarioAlise @Lena12361297430 Someone needing my number and keep distance ....😁 ... so lonely these covid days 😊
lof_cheek,My cousin took the covid 19 vaccine yesterday and now he’s penis has become bigger ! Guess where I’m walking to rn
george_stacey_,let’s make Year Three of Covid the best one yet!!
BMarchadesch,"Mixing Pfizer, AstraZeneca COVID-19 shots with Moderna gives better immune response -UK study https://t.co/Ly53IK0S32 via @gmanews"
sickofgenderwoo,@OkBiology Perhaps Covid victims should stage a protest too?Or old people?Or ill people?I really am sick of this
AnnieMaurice4,"An exceptionally important perspective on the anti-vaccine empire, by @PeterHotez @nature todayhttps://t.co/PgJ2XQiRb1The need for a counteroffensive to hundreds of websites, ~58 million social media followers, influential groups, Russia-sponsored disinformation to defeat covid https://t.co/Pg47HdqP7H"
forcd2tweet,@danker_hank @jacobdotgov Even total reanimation wouldn’t undo a death event that occurred prior.Would killing a covid zombie count as a second death attributed to covid?
JosephMunda,"At my first Administrative Council of @_ARIPO as DG, I am happy to report the that the Organization, despite Covid-19 challenges, has continued to demonstrate resilience with undisrupted operations &amp; recorded remarkable successes in operations, finances &amp; cooperation. https://t.co/7uO8Gko92Y"
normsaid,"TRIPLE VACCINATED DR GETS COVID. You get it, yet?  5,6,7 it never endshttps://t.co/Ek4K3pasdm"
JonMorley18,Patrick Christys: 'More people will die as a result of our response to Covid than from Covid itself.' https://t.co/jfRHeJKvah
atukunda256,"Many lessons learnt from the Covid-19 pandemic, among which is raising awareness that we need to strengthen universal services especially in the health, justice and education sectors."
maxivanKE,4.6M doses of COVID-19 vaccines received in Nairobi today.
MinarvaPanda4,"Again on leave! covid Positive!Did CBI team solved this mystry of quarantine and leave❓ @IPS_Association @DoPTGoI and all this people who were on vacation, did they went on vacation after their portion of work done in this pre planned death ❓❗CBI Y KHATRI NOT PROBED 4 SSR https://t.co/Xh1tsOOY4v"
Karabz20,It’s absolutely ridiculous that 2 years later a COVID test is still R850
botti_joyce,"I have seen an uptick in young pregnant women with COVID. To be totally, absolutely, completely clear: the vaccine is safe and effective in pregnancy, and COVID-19 is not. COVID-19 is associated with many terrible things in pregnant women, including fetal loss and maternal death."
TirtsasKram,"NEWS: 47,000 more people died of malaria due to COVID-19 disruptions - setting back progress on malaria by years. Millions remain out of reach of tests, medicines, bednets and the new malaria vaccine that save lives. We must do more to reach the unreached.https://t.co/agBEm5Vg7Q"
NUH_LEO,@nottmhospitals @TeamNUH @MelvinWar2004 @sharwalli @MiriamRDuffy Shirley’s project #electronicnotes #medway to improve pt experience and service. Covid-19 changes pushed electronic system usage #leo https://t.co/BjwkLvKfYt
AnaLuciaChocano,"An exceptionally important perspective on the anti-vaccine empire, by @PeterHotez @nature todayhttps://t.co/PgJ2XQiRb1The need for a counteroffensive to hundreds of websites, ~58 million social media followers, influential groups, Russia-sponsored disinformation to defeat covid https://t.co/Pg47HdqP7H"
KatlegoKaG,I got sick from Covid in Jan then ling suffering. Then in June i got the jab &amp; i got more worse than being covid+Been sick the whole year from whatever that makes me sick.Should my employer adopt the mandatory vaccination i am ready to resign @FaithMangope #PowerTalk
mathewogreen,"“In a single day, the union has caused more disruption to our public education system than we've seen due to COVID throughout the entirety of this term,"" Ms Mitchell said” @abcnews. Really, I thought we were heroes in Term 3? 🤦🏼‍♂️@smitchellmlc @GeorgeHarrisson 🤦🏼‍♂️🤦🏼‍♂️ @TeachersFed 🙌🏻"
MaryCarstensen,"School-aged children have the highest rates of infection of any age groupHospital admissions are 33% higher for those aged 5 to 14 years than in January 202177,000 children aged 2 to 16 are reported to be suffering long COVIDtime to do more #ProtectPupils #ProtectEducation."
DemocracyGB,Serco recently said its profits will be higher than expected in 2021 due to its Covid-related work including Test &amp; Trace.We need to kick the private companies out of Test &amp; Trace.And we need a Windfall Tax on the corporations that have made super-profits out of this crisis.
OL_Vision,Understand that Spurs have indeed had a Covid outbreak in their camp this week. More info below. https://t.co/lBbkRnUDeN
Jacande53,"I've seen the hashtag, not an organ donor anymore, I'm calling bullshit, if people were genuine about organ donation, I'm registered and have been for years, not getting a Covid vaccine would be in complete contradiction to the spirit of it, reckon it's a total fabrication."
adamjennison,"@puntofisso Well networks are the usual vector for viruses, hopefully covid hasn't mutated enough to bring down the Linux kernel..😶Obviously you've created a honeypot for virus testing..I presume you're running HoneyDrive?"
FairbanksJarrad,120 fully vaccinated people attended a Christmas party in heavily vaccinated Norway. As many as 100 caught Covid. Do continue to tell me the vaccine helps prevent spread… https://t.co/uYMR71S0CV
sallyrussell124,"Of course they might agree outright, especially if you have vulnerabilities in the home After all, covid is currently out of control &amp; the risks with the new variant are unknown for all agesAn arrangement until January, when the risks are quantifiable, might be accepted https://t.co/8rS5t6h83b"
Raasay1947,"My Mum spent last Christmas on her own while my Dad was in hospital with covid, he didn’t last till New Year. She couldn’t say goodbye to him and I Couldn’t hug her at his funeral because of covid rules. All while the government partied. #WhoWasAtTheParty"
NeoModihapula,"Chiefs are putting a team together for Arrows, so far their request to cancel fixtures for 2021 has been denied. The show must go on. #SLSiya https://t.co/jfwSSFooPZ"
JorgWalther,"My Mum spent last Christmas on her own while my Dad was in hospital with covid, he didn’t last till New Year. She couldn’t say goodbye to him and I Couldn’t hug her at his funeral because of covid rules. All while the government partied. #WhoWasAtTheParty"
DaBistDuPlatter,The Help@Covid app is now also available for Android! Go get it now: https://t.co/xxJKxIUAefMore information: https://t.co/w3EuIeJGp3#ESD #CHES #QOL #PRO #ePRO #QualityOfLife #Covid19 #COVID19at @ibktwit @imed_tweets https://t.co/QpDAqDuHDh
czapstans,I love how Jihyo is comfortable enough to open up about her personal life on this show🥺 + jihyo in a hanbok 💖pajama friends season 2 when covid ends please🙏 and can someone sub other eps of season 1 😩#SongJiHyo #송지효 https://t.co/oBE7bdhnr6
RakitaCraft,"The government says “there was not a party” at No 10 last December and that no COVID rules were broken. A week into the story, this is a new 5-min video on the gap between the government’s assurances and available evidence. Produced by Michael Cox. https://t.co/cqIalvKKnB https://t.co/vWBxhOogI7"
ana_apiecar,Diabetes and the Risk of Long-term Post-COVID Symptomshttps://t.co/inEG0SQMrFLa diabetes no favorece el #sindromepostcovid https://t.co/NFLf7dr15C
OAlberts,COVID-19 a Pandemic of Fear ‘Manufactured’ by Authorities: Yale Epidemiologisthttps://t.co/UJ41Z4VymS
Mc15Gill,"My Mum spent last Christmas on her own while my Dad was in hospital with covid, he didn’t last till New Year. She couldn’t say goodbye to him and I Couldn’t hug her at his funeral because of covid rules. All while the government partied. #WhoWasAtTheParty"
MarkArt100,It's now more important than ever to ensure you're protected against Covid-19 and the Flu. Get your winter vaccines today for maximum protection while spending time with loved ones this festive season. Book online: https://t.co/0IxEKA6Xpx https://t.co/Vm31mLlT6I
Lobo51302769,Trump supporters are 3x more likely to die from Covid. Districts that voted for Trump had a 6x higher death rate in October than districts that voted for Biden. Misinformation has killed thousands of GOP and Trump voters. #Covid#Fresh#OneV1 https://t.co/3z8tvDoXt9
PatrickSlavin5,Serco recently said its profits will be higher than expected in 2021 due to its Covid-related work including Test &amp; Trace.We need to kick the private companies out of Test &amp; Trace.And we need a Windfall Tax on the corporations that have made super-profits out of this crisis.
Kenya_2U,Follow live #Covid updates:🔴 Omicron to be dominant variant ‘within weeks’ 🔴 India warns of ‘massive third wave’🔴 China reports increase in caseshttps://t.co/jY6BsCKwCx
TibetPeople,"Peng Shuai, Hong Kong, Tibet, Xinjiang, Covid - the issues overshadowing Beijing Olympics - Hong Kong Free Press HKFP https://t.co/Mb1mcVGuf8 @NoBeijing2022"
stecarterdublin,Covid “vaccines” devastation; they killed more people in one year than all vaccines combined in 33 years https://t.co/gIJ9sUk7F0
DiarioSpurs,#THFC have been hit by a Covid-19 outbreak ahead of Thursday's Europa Conference League match against Rennes
PintofThe,"As I said before, they appear united but their hearts are dividedWatch them now turn on each otherPfizer’s Chief Medical Officer: “other vaccines have caused DEATH not Pfizers”FACT check: this is covid DISINFORMATION  - Pfizer &amp; AZ both caused DEATHhttps://t.co/jPA84vQQwP https://t.co/p0lSYBJPm8"
Ringo_Lennon123,"TRIPLE VACCINATED DR GETS COVID. You get it, yet?  5,6,7 it never endshttps://t.co/Ek4K3pasdm"
soulsldn,If you went Wizkid get tested for COVID.
_LexyBonita,"How can you go to a concert knowing you have covid, that’s so badmind"
MedicalNewsBot,When the Surges Just Keep Coming: A View From the Covid VortexMore medical news at https://t.co/pvWdUgzL00#Epidemiology #MedTwitter #MedEd #MedNewshttps://t.co/rdYdCoXYAo
CornwallLive,Would they change everything just before Christmas?https://t.co/dWUS3bjyC7
grabthisbook,Fair play to the guy from Manchester Airport who was on Radio 5 this morning discussing the impact the new Covid tests have on travelling.Asked about comments from SAGE re the effectiveness of the testing he pointed out he runs an airport and isn't a scientist. Bravo sir 👏
arunk_bhulan,Modi has made us Vishva GuruNo matter..👉Nagaland burning👉China invading our land👉Inflation is making record👉Unemployment all time high👉Farm &amp; Farmers are under stress👉Top in Hunger Index &amp; Covid deaths👉Bottom in GDP(amongst Asian countries)👉Modia shielding govt https://t.co/LIap0i1Axt
Jens_Lindner_,120 fully vaccinated people attended a Christmas party in heavily vaccinated Norway. As many as 100 caught Covid. Do continue to tell me the vaccine helps prevent spread… https://t.co/uYMR71S0CV
NickisKCING,There aren't enough workers in the rural processing plants because Tyson etc let COVID spread and it killed or disabled a workforce they're finding isn't as disposable as they were treating them. https://t.co/rF88npM8h2
toni_thwd1,"Idk what's worse, if being stupid to the point of believing Covid-19 is a lie, or being stupid to the point of proudly saying it without realizing how badly you're humiliating yourself."
RedWhiteBlueDot,".@StateDeptSpox announces that all air travelers aged 2 and older coming to the United States are required to show a negative COVID-19 test taken within one day of their departure, starting today. https://t.co/ZPJ5iVNnz0"
BellaManganne,"🇫🇷 In a French Study Of 27,000 Participants Who Claimed They Were Suffering From “Long Covid,” Only 4% Actually Tested Positive for The Virus.🤣🤣🤣Fm JustDudeChannel."
Bernade63062744,"On 18 Dec - when Downing Street staff broke their own Covid rules by boozing it up at a Christmas party - 489 people died of Covid. Their loved ones distraught, cut off, unable to say goodbye to them. I think this is despicable."
CarrissaRomero,I was told this if the 5th time since covid happen he’s doing this… 😑
SarahAlateeqi,Covid killed⚰️ science⚰️ logic⚰️ evidence-based medicine⚰️ common senseA deadly pandemic indeed.
DawnInspiration,Okay so if I am an anti vaxer for not taking the COVID vaccine. ( one vaccine). Does that make everyone who didn’t take the flu vaccine an anti vaxer. They say they don’t need it or want it. So what’s the diff.
awaken2evolve,"@aniobrien @voices_nz They will try and sell it to the public that there are some people who don't want to be part of the covid ""protection"" plan and they need to be locked up to keep the rest of us safe."
LHxx1010,"Just a reminder that my case of Covid was assessed to be *mild* and now I can’t live independently, can’t work and must rest before and after a shower. Please please please let’s not lose sight of the risks."
niahtj,@Kliqzx COVID is an L
condorbox,"Coronavirus latest news: UK's omicron Covid cases could surpass red list countries in matter of days, warns expert - https://t.co/1kg09EqvVQ #news https://t.co/luZyDN39hH"
small_grey_bear,Can't quite be bothered to click the bait laid out by the Telegraph: Kirstie Allsopp: 'Covid has definitely revealed a mealy-mouthed gutlessness in people'Except... said the work from home property developer presenter and Tory gobshite.
jichotvkenya,"BREAKING: #Uganda confirms nine cases of #Omicron Covid-19 variant, becoming the first East African country to report the strain. #JichoTVNews https://t.co/TL20UKtsBC"
Susan29191404,"@benitakolovos We in Qld need tourism $$$ but we don't need covid carriers from NSW.  If there's a threat from there, I trust our Premier to slam the border shut, as she did last year, or at least have a bubble for border-dwellers to move a few streets into Qld"
CliveSC,"In other words, my little book on #NotreDame won a German literary prize! Covid restrictions cancelled both trip and ceremony so I received the award by zoom, as you do. Vielen Dank, meine Freunde! https://t.co/7lXRpGO3Jj"
danobrien20,"@TJRyan_77 @CDCgov I'll await your data. In the meantime, and as you mention @CDCgov, all-cause mortality for American 1-14 year olds since the pandemic started in the first chart, and for over 75s in 2nd. When it comes to Covid, we should worry about our parents, not our kids. https://t.co/KuQCwFxQlS"
Docsocksomaha,"Lot of folks outraged about vaccine mandatesI understand. No one likes mandatesI wish people felt the same outrage over 1,000 Americans dying every day from COVIDMost of whom are unvaccinatedIf you are tired of this pandemic as I amPlease focus on ending it"
Newsdiarioibiza,"Chants of ""Covid passport, unconstitutional!"" mix with Christmas carols in Vara de Rey https://t.co/H9yuyuIaSM"
LVidance,💎New Gem💎🔥Omicron Inu(BSC)🔥The Meme COVID token #OMKR🔒 Locked and Renounced💰 MCAP:$41k💴 3% BUSD Rewards🌐https://t.co/FLhyLqiBOZ💬https://t.co/nMvTN2Sam4✅Contract 0x5fe07cdc112634d2a4a635c0232a64f284b20c15✅Chart https://t.co/Uq9lYvKxnP…#BSC #OMKR https://t.co/I3FwRjkYOs
lostindisco,"According to @BBCr4today UK Govt will only bring in additional #COVID19 measures if #Omicron more ‘dangerous’.  If its transmission significantly higher but symptoms no more severe, it will be more dangerous in terms of number of people with serious disease and long Covid."
xRightOnRedx,Hooray! More govt strong-arm control over small PRIVATE businesses. Just what everyone wanted!To be told who can patronize their business &amp; who can't. Hail King Inslee! We ❤️ a 2-tier society. @GovInslee#Power #Control #Dictate #Fear #Discriminate #Exilehttps://t.co/PfPmDduOSg
RoryHearne,"New @RebootPod as @RoryHearne is joined again by guest host @muinteoirjana to talk COVID in Schools and #RespectForSNAs with @SNAsSpeakOut, @lindaosull88, @simonmlewis and @Orla_Hegarty Listen now:https://t.co/hEuf5iaagh https://t.co/MEM6ig4pic"
equissentially,Look what has happened to the number of daily confirmed new Covid cases since vaccine passports were introduced in Germany and France. https://t.co/3Vycm0O1tp
