username,tweetVampire__knyte,"If we'd done nothing to control the spread of Covid then the cake would be much bigger, the Covid slice vastly bigger and the other slices most likely bigger too as hospitals would have been totally overwhelmed.But we still need to weigh the costs of lockdown in the equation. https://t.co/LpOvDwsxqY"
AEqu1tasEqu1tas,"Numbers of COVID cases likely to be the #OmicronVariant are increasing rapidly in EnglandSGTF data indicate 994 likely cases, including 2% of swabs from 4th DecemberThis gives a worst case scenario of ~2500 cases so far and an R-value of 3.47 (CI 2.75 - 4.40)Detail in thread https://t.co/BnyHP36jfA"
pedroferrer305,"BREAKING: A woman in her 40s from northwest Harris County has tested positive for the omicron variant of COVID-19, the first confirmed case in Texas. https://t.co/9xqfrj4rPY"
DHurray,A year ago today I laid in a hospital ICU fighting for my life due to Covid. I would like thank all Healthcare workers for their sacrifice and dedication! #grateful
Brown42Obi,let’s make Year Three of Covid the best one yet!!
GaiMorGor,Covid killed⚰️ science⚰️ logic⚰️ evidence-based medicine⚰️ common senseA deadly pandemic indeed.
KishanExpress,https://t.co/815iGXqK0M@Amitsen_TNIE @Arunkumar_TNIE @pmdvaidya @CovidKarnataka #strongwill lady fights Covid for five months. @DipoVarte @KoppalVartha #koppal #KIMSKoppal
waffle_board,"No team has done a better job of avoiding the dangers of CoV-19 than these Seahawks. The team incredibly went the entire 2020 season without a single COVID-19 case…Now, coach Pete Carroll says the entire team is getting booster shots today. https://t.co/dWWUEsC67i"
livingnexisting,"The above graph shows the proportion of the whole population who have Long Covid, so it will be shaped by which age groups were infected with Covid at what time.Eg the growth seen here in 17-25 year olds is a feature of the large number of cases in this group over the summer."
IanBrownwc1,As many as 6 million eligible Britons may not have had a Covid jab. Who are they? https://t.co/FLKoGY8rmF
geochetan,"Gate of Safina Plaza, Bengaluru, rudely demands in Hindi for Covid vaccination certificate. I take time to trace, 2nd dose SMS. He tells me 2 speak Hindi, then rudely tells me to leave the place if I cannot show the Certificate ⁦@BSBommai⁩ ⁦@PLEKarnataka⁩ https://t.co/BKqCEdzTI3"
juba_wong,"China has warned that the US will ""pay the price"" for a diplomatic boycott of the Beijing Winter Olympics over human rights concerns. ""Stay tuned,"" Chinese foreign ministry spokesman Zhao Lijian said. In full: https://t.co/bG5aYHKEIM https://t.co/3JqNXq2Hyt"
capehidub,Gonna tell my kids this was the Covid test https://t.co/ABCneZ2Qjk
USwillRiseAgain,Dr. Shaquita Bell is absolutely certain a vaccine can't make your child sick with COVID—because the vaccines don't contain the virus that causes COVID.
KittyTrill,Storm Barra doing more for the prevention of COVID in schools than Norma Foley.
MilitanMarcelo_,You people have COVID &amp; are talking about flu. Go &amp; test yourselves https://t.co/unZuXRKcTo
profa054,Key lesson 1: we observe an extreme level of wealth concentration across the world. The richest 10% own around 60-80% of wealth in the various world regions. The poorest 50% always own less than 5%. And wealth inequality has been rising after Covid. https://t.co/ZKzGcRsswV
BhutManinginin1,@ZacMoselane @KoketsoMASH @NdaedzoNN BCEA deals with safety precautions that all employer must reasonably to  deal with safety and potential safety issue resulting from the nature of production or business.Could you please justify Covid as resulting from work employers nature of business or production?
send2gl,"I've read that the Polish President said that the way Polish people are, there is no way to try Covid passports in Poland. This is the greatest compliment of Poles I've ever heard."
deleswife1,please don’t hope covid has hit certain players in spurs it’s not funny icl
CariCorbett100,"How many people did #TyphoidTrump knowingly infect with #Covid after he tested positive last year? Between that &amp; producing Don Jr., Eric &amp; Ivanka, it seems like #trumps fluids are hell bent on destroying the world."
y_gigfran,"Woah. Today's numbers take us past FIVE MILLION confirmed Covid cases since the Johnson regime's cavalier, callous and calamitous 'freedom day' on 19 July."
LokmatNewsEng,"#omicroncoronavirusBengaluru doctor who recovered from Omicron tests Covid positive againThe city-based doctor, who had tested positive for Omicron variant of COVID-19 and reportedly recovered, has once again tested positive for the virushttps://t.co/4gRIRtw4Un"
Mohamme31861699,@NSUIKarnataka #OmicronVirus Due to this deadly virus parents are not sending to write exams in Bangalore if they follow covid protocols also why cases are increasing day by day in schools and colleges please  #closeschoolsandcolleges in Karnataka don't play with students future @BSBommai sir
jeangene_vilmer,.@jeangene_vilmer covered the French response to information manipulation in our report on #disinformation: https://t.co/sV3G1lhmUl https://t.co/5eI84IxcKn
Karen33589301,British Health Secretary Sajid Javid confirms that none who have tested positive for the Omicron variant of Covid-19 in the UK have been hospitalised.
IRVINENP,"SAY NO TO JAB MANDATES Another huge crowd tonight, this time in Warwick! Queenslanders are fed up with these coercive COVID-19 vaccine mandates and they are making their voices heard! https://t.co/UpEDCOoUS8"
Behaxeltzi,"You must wear a face covering throughout your journey, unless you’re exempt. Please continue to wash and sanitise your hands regularly, give space to others and pay by contactless, if you can. Find out more about travelling safely &gt; https://t.co/nTMkJADspM https://t.co/YXP9O3OTLP"
johndmtb,"Come on folks, don't let the brainwashed little Hitlers take away your freedom. Think they will stop at covid passes??? https://t.co/4XiFMkUwrl"
AhmadEl50546565,"❝Turkey will soon put its domestic COVID-19 vaccine Turkovac at disposal of humanity,❞ says Turkish President Erdogan at UN General Assembly https://t.co/MtLuknPyvh"
AdamsNsereko,Panic as Uganda confirms new 9 cases of Omicron COVID-19 variantDETAILS HERE👇 #boomugnews | https://t.co/vcxkGU6hKvhttps://t.co/1Zv46KdM0Z
lazysauce1,"DESPERATE WAKE UP CALL:By offering “boosters” every 3 months, they’re NOT telling you you’ll get enhanced protection each time. They’re telling you that these things wane after 3 months leaving you immuno-deficient.What do you think 4/year will do?https://t.co/mY0jxQbShz"
Jules_Cath,@gsw41958 @AngelaRayner The Coke ‘n’ Covid party
BilasHeidi,"You know what would be great? If our #AntivaxPremier  could find some time to drop by a pediatric vaccine clinic, too, to help encourage parents to protect their children from COVID. 'Tis the season. https://t.co/7v6BQUzUDc"
chaplinez70,"One in three people with sniffles actually have Covid, expert says https://t.co/pD4RxYEgPJ"
ianfmartin,"Soothing some of my pain from the the fact that two covid-driven Japan cancellations means I’ll probably never get a chance to see Stereolab in my life by watching Buffalo Daughter, who are Japan’s own best players in that avant-pop/post-kraut sphere."
iot_automotive,"New regular monthly statistics are being published by @DfTstats showing overall chargepoint numbers in the UK. Only one line of figures so far - but it will quickly add up. Total of 27,614 devices including 5,088 rapids. Data from @zap_map https://t.co/iUoiYYxD2r"
vikky3214,"Covid: 85% adults got at least 1 dose, over 50% fully vaccinated https://t.co/tQ9NSLgylg"
sallyrussell124,@dave_democracy @_despicable_ @DebsFrazer @erbrooker Exactly and with 1 in 7 children suffering from long covid and long term effects unknown mine won’t be going back until schools are safer for everyone. Children are being treated like second class citizens.
weegayle,Man calls out liar after setting the lying about covid regs bar at astounding levels.Go away you cretin. https://t.co/nw7CA98YpT
KevinHu29807061,Covid has definitely revealed some desperate publicity seekers https://t.co/WY7QqmyQi6
pierredrilecto,"US response to Covid has ultimately been like our response to school shootings: Once we decided unimaginable loss was a price worth paying for an imagined ideal of freedom, the number of deaths ceased to matter. We’d trade a million lives for our need to do exactly what we want."
thekaiju,let’s make Year Three of Covid the best one yet!!
Frank09295806,"Deputy Prime Minister Dominic Raab has denied No 10 held a Christmas party last year whilst the rest of the country had to follow Covid restrictions.Julia: ""People are absolutely furious about this. Do you understand why people are angry?""@JuliaHB1 | @DominicRaab https://t.co/iwduuCGljj"
LaVonne54895931,🚨 Breaking: Israeli Ministry of Health announced today that it will soon approve the 4th vaccine shot.It will mean that all those with 3 shots who don't get the 4th shot will have their Covid passes revoked (as happened to those with 2 shots).Soon in your country.
LarocheCS,"An exceptionally important perspective on the anti-vaccine empire, by @PeterHotez @nature todayhttps://t.co/PgJ2XQiRb1The need for a counteroffensive to hundreds of websites, ~58 million social media followers, influential groups, Russia-sponsored disinformation to defeat covid https://t.co/Pg47HdqP7H"
Hakuna_Mytatas,"Loss of motivation has to be a Covid symptom, I ain’t feel the same since March 2020"
CarrickAndrewss,"Loss of motivation has to be a Covid symptom, I ain’t feel the same since March 2020"
kattrejones,Heart inflammation cases post-vax had been averaging 41 reports a day - until last week.Total cases to date:2 Dec 2220👇7625 Nov 2296☝️31418 Nov 1982☝️22311 Nov 1759☝️1594 Nov 1600☝️18328 Oct 1417☝️23628 Nov 1181☝️17314 Oct 1008☝️1587 Oct 850https://t.co/11ddtgdTPj
KoivistoChris,"Between resuming student loan payments, ending unemployment benefits, letting eviction moratoriums lapse, laughing at free COVID tests, letting Roe die, &amp; feeding an inflation narrative that has let companies price gouge with impunity.. we sure are building back better! 🤡"
McMike89526469,#Breaking: Uganda has confirmed 9 Cases of Omicron COVID-19 Variant. #NBSUpdates@nbstv
eurohoschie,"Last month MPs ordered govt to publish all documents that could show whether Owen Paterson helped get £480m of covid contracts for Randox who he was advising &amp; to show minutes of a meeting between Paterson, Randox &amp; Bethell. Still nothing. They're hoping it'll go away. It won't"
Ghandya,"V unwise for No10 to lie about this but PM set the course of lying on covid in spring when he decided to start rewriting history, deny herd immunity plan etc. NB some lobby hacks were also at parties in No10 flat so trying to bury this story... https://t.co/pYMRiOgULV"
charleycharleyH,"Hannan’s false comfort over Covid is almost on a par with his false projection of the sunlit uplands of Brexit. And how are his falsities punished? With a place in the House of Lords, no less. In this country, no good deed goes unpunished, and no bad deed unrewarded https://t.co/r3po86NQCd"
KingsCollegeNHS,"📺 ICYMI: Tess Dunning, Head of Midwifery at King’s College Hospital, spoke to @BBCLondonNews yesterday about the importance of pregnant women taking up the #COVID19 vaccine. More info from the NHS here ➡️  https://t.co/zwMyOj4ePb https://t.co/y4z3xIpqlV"
Alkak68198977,"Beating thalis, lighting diyas, was to support our health workers and doctors who worked day and night to save lives. This was done the world over - London, Madrid, Berlin.1756 Indian doctors succumbed to CoVID. They saved you, so you could then turn around and mock them. https://t.co/coXI3cSMnz"
leone_rotich,"I love aviation,have done since being a little girl. I worked hard to get into an industry that has the most passionate &amp; dedicated people I've met. We've faced the decimation of our industry by Covid &amp; idiotic decision makers but still we fight. I love my aviation family. ✈️ https://t.co/gIGHKhPdTA"
SayNoToPutin,"Whether it's conservatives believing that 5G causes COVID or liberals believing that there are security issues with Bluetooth, neither side seems completely comfortable with contemporary wireless communication."
nick_pope,"Incredibly simplistic blame on cycle lanes. Most Londoners also know endless, badly planned roadworks to blame, reliance on cars &amp; people afraid to use the underground post COVID.  Cycle lanes blamed as London becomes world’s most congested city https://t.co/Ilaxo9EkOB"
qingdong17,🚨 Breaking: Israeli Ministry of Health announced today that it will soon approve the 4th vaccine shot.It will mean that all those with 3 shots who don't get the 4th shot will have their Covid passes revoked (as happened to those with 2 shots).Soon in your country.
_z31N,let’s make Year Three of Covid the best one yet!!
madeleine_noll,"#COVID19 dogs could revolutionise how we detect the virus.But these clever canines need your help getting odour samples 🐕‍🦺If you've taken a positive #PCR test in the past 3⃣ days, find out how you can volunteer 👉 https://t.co/XcGCjn1QaJ@MedDetectDogs @durham_uni https://t.co/o3COVNWuGx"
handofcongress,"One of the biggest religious Covid anti-vaxxer in the US is dead …from Covid.Good reminder to some here at home, who are still creating doubts about vaccines. https://t.co/fKhvzndNMb"
tebessumben,"The Delta variant remains dominant across Europe and Central Asia, and we know that the COVID-19 vaccines remain effective in reducing severe disease and deaths from it @hans_kluge"
amani_xxv,If you went Wizkid get tested for COVID.
LittleV33244419,"This is sick!!! Rare heart condition triggered by Covid vaccine is 'mild and resolves quickly', say scientists https://t.co/VkB1tyAiG0"
ladygeeke,1. Illegal Christmas parties held 2020. 2. Drug traces found throughout Parliament. 3. Gov failed to help afghans during evacuation.4. Johnson cosplaying as police officer. 5. UK registers highest COVID infections in Europe. It's only Tuesday..........🙄
DavidHirsh,"@ValoisDuBins Do we imagine that medical staff in Covid wards didn't have a blow out or two? At Christmas?Honestly, I have no idea if they did or they didn't.I kinda hope they did."
Lotus_of_Honor,Trump supporters are 3x more likely to die from Covid. Districts that voted for Trump had a 6x higher death rate in October than districts that voted for Biden. Misinformation has killed thousands of GOP and Trump voters. #Covid#Fresh#OneV1 https://t.co/3z8tvDoXt9
Fair4all3,I’ve heard the same heart attack &amp; stroke story from nurses in my local hospital plus aggressive cancer increases...both new cancers and remission to suddenly spread throughout the body after COVID vaccine. It is not hard to understand why so many medical staff refuse the vaccine https://t.co/ORuUQ5A2Kc
RadicalAFree,"Not only is the article in the very reputable medical publication, extremely interesting. But so is the Twitter warning relating to this publication!!To me this would suggest the main benefit of vax is to the individual and not others! Therefore no need for covid passes https://t.co/rkNnPvOUle"
Andy_In_The_UK,"Covid outbreak strikes vessel carrying 3,200 FULLY VACCINATED passengers. The clearest example yet that VACCINE PASSPORTS DO NOT WORK #NoVaccinePassportsAnywhere https://t.co/33CsXQEtMp"
AskDrShashank,"@bonyuppal @PMOIndia @MoHFW_INDIA @mansukhmandviya @DrJitendraSingh @DrBharatippawar No all virus don't have potential like covid to disrupt we wish future has milder less harmful strains which won't disrupt the world .last 2 years we have seen from ancestral Wuhan strain to all strains like alpha beta delta Gamma disrupt world ,we hope Omicron does not do that"
jagxjr40,"England Child Covid Cases 6th December0-9     706,501 a rise of  6799 ⬆️ (+581)10-14  887,695 a rise of  5988 ⬆️ (+958)15-19  772,722 a rise of   2804 ⬆️ (+431)Total 15,591 = 37.5% of new English Cases 41,525⬆️⬇️=Up or down on yesterday#coronavirus  #SARSCoV2 #COVID19"
dweller_fringe,In October I wrote to the Queensland Premier with the hard facts on COVID19 and the jabs. Her reply to me was another example of the Queensland Government completely ignoring facts and reality so that they can keep control over Queenslanders.https://t.co/lXTL4AJiSj https://t.co/YpiLHPRDIa
PatmoreD,120 fully vaccinated people attended a Christmas party in heavily vaccinated Norway. As many as 100 caught Covid. Do continue to tell me the vaccine helps prevent spread… https://t.co/uYMR71S0CV
Michael47298938,"The government says “there was not a party” at No 10 last December and that no COVID rules were broken. A week into the story, this is a new 5-min video on the gap between the government’s assurances and available evidence. Produced by Michael Cox. https://t.co/cqIalvKKnB https://t.co/vWBxhOogI7"
MroboNeliswa,If you can’t sue Pfizer and Moderna if you experience severe side effects after getting the COVID-19 vaccine why should it be mandatory then? 🤔
insidebizng,WHO Warns Against Use Of Convalescent Plasma For COVID-19 Treatment https://t.co/BLDOr8Sntc
GenerousUk,"Hope they are checking the effects of different vaccines when used as a 3rd or booster jab. Had 2 Astra followed by the Moderna so would love to know what it did.Moderna or Novavax after AstraZeneca jab confers high Covid immunity, study finds https://t.co/nL1etI19Pc"
rambhadiya,"@del_airindia please answer call , revert to mail, I am covid positive and can't travel please help me getting refund Z0MHE, AI 868, MY WIFE ALSO POSITIVE, see this reports https://t.co/wuJdI579AL"
marziodb,"Follow the money for some great news!""Vaccine stocks BioNTech (BNTX) and Moderna (MRNA) crumbled Monday as early reports suggested the omicron variant might lead to less severe cases of Covid"" https://t.co/N1XtN1knaG"
dolgoyangi,"I need to talk about something that is really bugging me for a while now. Here we go....GCC was the first time I got to meet Misha. I was terribly nervous, bc hey, I waited for this moment to happen for more than a decade. Time went on, many guests canceled due to Covid, 1/24 https://t.co/gBRjiNo8X5"
OkBloomer7,"Numbers of COVID cases likely to be the #OmicronVariant are increasing rapidly in EnglandSGTF data indicate 994 likely cases, including 2% of swabs from 4th DecemberThis gives a worst case scenario of ~2500 cases so far and an R-value of 3.47 (CI 2.75 - 4.40)Detail in thread https://t.co/BnyHP36jfA"
ojopete42451339,"The players and staff must all now self-isolate for 10 days under government guidelines, ruling them out of Tottenham's next three matches. https://t.co/oWI6YKXnTz"
sdavis0510,"As covid persists, nurses are leaving staff jobs — and tripling their salaries as travelers https://t.co/QmLPkDk0wU"
NgceboMthiya,@NgceboMthiya I'm gonna do Covid testing now.. They said they gonna put it in my nose 😭😭😭 https://t.co/lTzKBdzgv1
MphoMoseki19,We all have covid in this house 😩😢
buffalomunro,"I've read that the Polish President said that the way Polish people are, there is no way to try Covid passports in Poland. This is the greatest compliment of Poles I've ever heard."
Mary03070298,"I was speaking to Nurse in York on Saturday and her hospital covid ward is full of double jabbed patients, 100% double jabbed! @EssexPR @Iromg @PJPOWER14"
AngelaBellicose,How interesting for you Adam. My mother caught covid and died. https://t.co/5GlOWCBBbc
sifahmasuku,Brilliant move. https://t.co/NrWPr3Ks3a
SchoenmakersRo2,"Australian Hayley Hodgson was placed in a Covid internment camp despite testing negative for the virus She was confined to a box for 14 days, offered valium when she complained about confinement, and lost her job""You feel like you're in prison...""https://t.co/VaUoSmgx2T https://t.co/fMs2HS0c5R"
Atchitsssssssss,"If there is one thing that we should not neglect to do every day of our lives, it is to constantly pray and give thanks to God.Read more: https://t.co/oy6mSNAUX7🌿Accepting Christ and His Words#PureDoctrinesOfChrist#GlobalPrayerForHumanity"
Soupmaman,"My Mum spent last Christmas on her own while my Dad was in hospital with covid, he didn’t last till New Year. She couldn’t say goodbye to him and I Couldn’t hug her at his funeral because of covid rules. All while the government partied. #WhoWasAtTheParty"
LongCovidFight,First Hampshire Omicron cases confirmed in junior school No masks or vaccines for primary children .https://t.co/jZqHyJAfYy
TimesTelegram,The federal Homeowner Assistance Fund will provide nearly $539 million for eligible New Yorkers struggling to stay in their homes. https://t.co/FXtkdd72GR
PrinceAditya431,"Beating thalis, lighting diyas, was to support our health workers and doctors who worked day and night to save lives. This was done the world over - London, Madrid, Berlin.1756 Indian doctors succumbed to CoVID. They saved you, so you could then turn around and mock them. https://t.co/coXI3cSMnz"
27Tawnyowl,'You can't keep stopping and starting the economy every time there is a new variant': Theresa May blasts Boris's handling of Omicron and demands the Government 'learns to live' with changes in Covidvia https://t.co/SoLYFq4fjs https://t.co/RCPn9VkyWO
SharifRutahigwa,#Breaking: Uganda has confirmed 9 Cases of Omicron COVID-19 Variant. #NBSUpdates@nbstv
moore_gen,"This is a COVID test, made by Abbott.In Europe, it costs ~ $4.00.In the U.S., it costs ~ $25.00.COVID is big business, folks. https://t.co/6WH8sdOFV3"
KeithMcCullough,"SOUTH AFRICA: up another +2.3% today, mocking American covid #clickbait outright at this pt https://t.co/XdkADceNZb"
wachira_WaGi2gi,"BREAKING: Uganda confirms nine cases of Omicron Covid-19 variant, becoming the first East African country to report the strain. https://t.co/LJSY0dPON8"
Tallis08847265,"@GideonCRozner Brillant tonight on #insidethenews @rowandean . Your right Gideon , nobody cared about #mentalhealth as #Socialism rolled through Australia under the guise of #covid.Well yourself, Rowan, @CraigKellyMP @JohnRuddick2 cared &amp; thank God for you guys. 2022 #fireup"
lahoare,"Tuesday, December 7:71.81% of the Austrian population has received at least one coronavirus vaccine dose;The seven-day incidence rate per 100,000 people is 581.2;664 intensive care beds are occupied by COVID-19 patients.#CoronaVirusAT #COVID19at"
cindyfsolomon,"I, myself, contracted Covid in April 2020 responding to emergency calls.We find ourselves in the position of raising funds to purchase much-needed medical equipment and supplies. 2/"
spot60spot,Former Aussie basketball star Ben Madgen says he was hospitalised with a rare inflammatory heart condition after his Covid-19 vaccine.https://t.co/kMrLe6769s
jcdiazlasala,Common sense Covid-19 policy coming out of Madridhttps://t.co/PdLGZCe7O0
RamprasannaRam1,#उन्नत_प्रदेश_उत्तर_प्रदेशPM Modi said that India is heading towards attaining 'Aatmanirbharta' in the Fertilizer industry after facing various shortcomings during the peak of COVID-19 that halted various activities.
thestarhalifax,Most Canadians support strong border measures amid new Omicron COVID-19 variant: poll https://t.co/nVRzpQsTh8
PharmChemUCC,How do the new anti-Covid drugs work? By Tim O'Sullivan &amp; JJ Keating @PharmChemUCC @Pharmacy_UCC @uccchemistry @UCC https://t.co/jQgo3M7GqC
leks04,"FG ""released"" N950m to each of the 52 teaching hospitals to combat COVID-19. That's nearly N50b. See what transpired when Budget Minister II Clem Agba visited Uniport Centre. Omo, guys don ""clean up!"" https://t.co/xpEULfIxOx"
gagadonlan,@AngelaRayner #whoattendedtheparty #downingstreetparty #DowningStreet 18 December 2020.One person died of Covid every 3 minutes.All day. https://t.co/EsTxJY0sll
SandraBetz3,REMDESIVIRWHY IS NO ONE TALKING ABOUT IT?COVID CONTROLLED SO NO PATIENTS?20% planet population trial terminated. What does that tell you?FAUCI FUNDED IT IN CHINA.FAUCI made it PROTOCOL.How did they make it protocol?       By #ToReSaYs https://t.co/jEt4EwHi8t
thistleflat,"Waiting to get my covid booster, so doing a bit of knitting with @GermanderCC fab sock kit! #MHHSBD #BoosterJab https://t.co/TY0Bm9xZkb"
ed_yew,@BokiSport @ShawniganCanuck @BenRothenberg Lol immunity. Do some reading first. You don't understand how Covid works
Piros12,Covid apart (assume that covid didn't exist) would you rather have a work Christmas party or a paid half day?
lelizardbitch,"Next on the list of blame, the unboosted.https://t.co/bpuQbkFhqW https://t.co/9kNOaMp7EE"
DarrenBellreads,Covid Vaccine passports are antithetical to public health principles. Vaccines help but do not prevent disease or transmission or death. It’s time scientists spoke out against vaccine covid passes. Politicians must Stop framing the response through lens of vaccines.
ScottishFotoExp,The Scottish Photography ExperienceEdinburgh Outlander #OutlanderActively taking bookings for all of my photography tours for 2022 and 2023. Your safety is paramount! I comply with all government Covid-19 guidelines at all times. https://t.co/RQcFWSuDcf https://t.co/4tX3wwq9Bq
PSG_LSHTM,"PSG's @anushehassan will present a paper from PSG's joint @EvoDemReligion project at #IPC2021 today. Her presentation ""Impact of the COVID-19 pandemic on support available to mothers in the UK and the US"" will appear in the Consequences of COVID on Family Life session at 16:00UTC"
