username,tweetGoaiDev,TESTIMONY: I Was Hit By COVID-19 —Pastor Janet Boynes https://t.co/68wyd4uNlW #blogs #website #javascript #100DaysOfCode #100DaysOfWriting #AI #Ai #3DaysOfCode #websitedevelopment #WritingCommunity #BloggingCommunity #writerslift #coding #30DaysOfCode #code #Robotics #blog
brown_and_sweet,Hey friends. We as Team Amito Foundation are running a fundraiser to raise support for families in Lamwo most affected by the Covid-19 pandemic especially the orphans. Please support us in any way possible to see this project go successfully and make a few families happy. https://t.co/b85tTma83U
Deborah16705000,"World record-holder in static breath-hold freediving, veteran triathlete, professional tennis player, professional mountain biker—all high-performing athletes until COVID vaccines ruined their health + their careers.#TheDefender: https://t.co/zL66Edfiw5https://t.co/L76vBedOOW"
nichols_lindy,@heideigger @jacindaardern Stuff provided analysis of what the initial fund was being spent on. A shitload of it went to Maaori causes.https://t.co/CWmVUYg0RI
Boqueteguy66,German Police very heavy handed in regulating Covid Mandates and the Nonsense... https://t.co/Odx88MBjyn
njoyflyfishing,7 Day Covid Growth in Deaths per 1K Population by County For UT   2021-12-03:  Covid Insights From Our Analytics Team and USAFacts #datavisualization #datascience #analytics #health #data #covid19 #publichealth #covid #omicron #globalhealth https://t.co/rYqtuEoalf
sclehdorn,"How I Beat COVID-19 in 48 Hours with Ivermectin, Just Like Joe Rogan and NFL Quarterback Aaron Rodgers  https://t.co/tX0tNtSREM"
Nonnepossopi1,"@Nonnepossopi1 Yes. Italy is a no-go zone: Samsung Italia 's corporate elite remain too powerful, despite the many Covid-sacrifices made by Italians. @ItalyinBelgium @ItalyinJPN @Ulkoministerio @eliodirupo @MofaJapan_jp @EmmanuelMacron"
AcesCherry,Having lunch with @bgyo_ph and @BINI_ph team. A group full of positivity. Love these guys! PS: We are all vaccinated and we all tested  negative to COVID-19 prior to this lunch. More pictures here: https://t.co/wjreggoDrS https://t.co/MUKjNiFcHX
kinghtmarecoys,"'Covid is killing people. Not the virus, but our response to it.'Patrick Christys gives his view on 'avoidable' deaths during the pandemic. https://t.co/Ed7lLk7xrZ"
harwinbosworth,"Good news for the doctors and nurses who valiantly took care of COVID patients, got COVID themselves, and who logically decided not to get vaccinated since nature already inoculated them. https://t.co/e2IXJvCVsX"
femmefaebel,"for the record, i can’t stand ppl getting upset at SE and blaming them for the problems. they have said since summer that it would be a mess, and they can’t get the resources needed due to scalpers and covid restrictions. and they still TRIED."
3rdEyeSages,My thread - BBCs interview with Pfizer CEO Albert Bourla.The most chilling thing I’ve seen in my life.1. He indicated Covid vaccinations will be a yearly event.2. He said he didn’t do it for the $35 billion in profits but for love.3. But he said they deserved those profits. https://t.co/FZldEUgA54
GothOnABrompton,@maggieswlondon I could only find details from several years ago and technology plus Covid :(  but are there charity Xmas cards for you any more? I'd pick them up from Charing Cross if there are. A few have started to come in and I'd love to reply with a Maggies one.
lynn_middleton,"My Mum spent last Christmas on her own while my Dad was in hospital with covid, he didn’t last till New Year. She couldn’t say goodbye to him and I Couldn’t hug her at his funeral because of covid rules. All while the government partied. #WhoWasAtTheParty"
MarieEmilia,"COVID-19 research freely accessible, but research data sharing and preprinting are low https://t.co/Jnjzc5eN9B"
_FunBot,TESTIMONY: I Was Hit By COVID-19 —Pastor Janet Boynes https://t.co/68wyd4uNlW #blogs #website #javascript #100DaysOfCode #100DaysOfWriting #AI #Ai #3DaysOfCode #websitedevelopment #WritingCommunity #BloggingCommunity #writerslift #coding #30DaysOfCode #code #Robotics #blog
Abhishe50965999,Why Wasn't Covid Test Conducted For Sushant ?@PMOIndia@HMOIndia@DoPTGoI@DrJitendraSingh CBI Y Khatri Not Probed 4 SSR ⁉️
LenalaStephen,"@HealthZA COVID - 19 is like any other Viruses we are aware, HIV we live with and awareness measures."
Skatiq3,Useful Q&amp;A with @rjlessells around #vaccines  Thanks @Bhekisisa_MGShare with all those fence-sitters#VaccinesWork#VaccinesSaveLives#COVID19 https://t.co/kZIJfmT44B
beaglebenn,"At this stage, this requires NO introduction… Touché 😂🤣 “At least 10 cases of COVID-19 have been reported on a Norwegian Cruise Line ship… All of the crew members and passengers taking part in the cruise have been fully vaccinated for COVID-19.” https://t.co/RdFsm47ogs"
mfc815,"Today's update on the Daily Sceptic is here. Italy tightens restrictions on the unjabbed, New York City announces vaccine mandate for private sector workers, and Dr. Noah Carl explores how Covid passports have reduced trust in public health authorities.https://t.co/AMmv9Q1KmX https://t.co/80S3jHot9f"
Chris_N247,"My Mum spent last Christmas on her own while my Dad was in hospital with covid, he didn’t last till New Year. She couldn’t say goodbye to him and I Couldn’t hug her at his funeral because of covid rules. All while the government partied. #WhoWasAtTheParty"
taainsurance,"Vaccine mandates hurt hardworking, lower-wage Americans &amp; small business owners most. There is no proof they ""beat"" COVID-19.As the 5th Circuit said of President Biden's illegal OSHA mandate, this is ""a one-size-fits-all sledgehammer"" that doesn't account for differential risks https://t.co/quLvflNOZX"
stackingsats,"The mall is a dystopian hell hole. QR code to see Santa, full mask compliance, covid kid vax clinic and flash your papers to eat fast food."
Magsymo,"@ShanMoff @pagainstthewind @nolumaki Then please explaine why family members and friends who are fully vaccinated have now tested positive for covid? And no, it is not just one person."
georgischip,@BBCRosAtkins I love the narrative from the Government on this...there was an illegal party but I'm assured no covid rules were broken😂
PatrickFbpe,"“If you think you’ve got a cold, there’s a good chance it’s Covid” https://t.co/t5qvh35HwL"
Trodzz,"Loss of motivation has to be a Covid symptom, I ain’t feel the same since March 2020"
lizmallard,A strategy for long term coping with covid and future waves/pandemics... What would a decent government be working to put in place?1. Increase hospital beds per head to levels we had in the last century.2. Train medical staff to staff those beds to the proper level. 1/
PhilipLederer,Many are ridiculing this dismissive and out of touch take by @PressSec on Covid tests.But for me it’s the ‘how much does it cost’ part.We spent BILLIONS AND BILLIONS on vaccines that we would never consider charging for.Tests should be no different.https://t.co/bf7JnpYTbH
__teniao,"How can you go to a concert knowing you have covid, that’s so badmind"
ellielou_uk,"Numbers of COVID cases likely to be the #OmicronVariant are increasing rapidly in EnglandSGTF data indicate 994 likely cases, including 2% of swabs from 4th DecemberThis gives a worst case scenario of ~2500 cases so far and an R-value of 3.47 (CI 2.75 - 4.40)Detail in thread https://t.co/BnyHP36jfA"
AdoreAppys,Covid silver lining: ‘Extremely mild’ Omicron variant is rapidly killing off much more deadly Delta coronavirus mutation. https://t.co/WC4v6mLkoI
FiL1426,Not in the News: COVID Epidemiology. It is negligent to ignore the vaccinated as a source of transmission when deciding about public health control measures. My newest article in Substack. @RWMaloneMD https://t.co/uVLOuYmy9n
stomusvoci,"Loss of motivation has to be a Covid symptom, I ain’t feel the same since March 2020"
BobSmit93897966,"They keep mandating more and more intrusive plans to “Stop Covid”- those things fail, so then they not only keep doing those failed things, they add even more aggressive measures on top of that It is absolute madness"
vuduquebec,Tell us about the people you have lost to Covid  https://t.co/OTMUU8VfGs
shaunbear8,"The immediate reflex to give young healthy people a 3rd vaccine dose to protect against Omicron is not supported by data, nor is it necessary for anyone who has natural immunity based on the studies we have to date. https://t.co/Xhajsu1mW2"
JanekirbyPA,"Another day, another new set of rules for travellers. Hopefully I've answered any questions you might have here: https://t.co/89AbRTmesy"
joboxer12,"Just a reminder that my case of Covid was assessed to be *mild* and now I can’t live independently, can’t work and must rest before and after a shower. Please please please let’s not lose sight of the risks."
zazilemkez,"President Cyril Ramaphosa has called for the national coronavirus command council to meet as soon as he returns from a trip to west Africa on Wednesday, amid rapidly rising Covid-19 infections. | @City_Press https://t.co/Y6yQpNeWpW"
Kachi1_,🚨🚨 | NEW: Self-isolating Sports Direct staff have been told to go into work despite having Covid-19
RennerChad,"BIG: As Omicron spreads, researchers in Pretoria, South Africa, say COVID patients there are much less sick than those they have treated before.*Most of their infected patients were admitted for other reasons and have no Covid symptoms.https://t.co/EK2h8gkL6j"
TPerch,🚨 | NEW: Ministers have given GPs in England the green light to provide less care to millions of patients for the next four months so they can deliver Covid booster jabs.Via @guardian
ksmtotheworld,TESTIMONY: I Was Hit By COVID-19 —Pastor Janet Boynes https://t.co/68wyd4uNlW #blogs #website #javascript #100DaysOfCode #100DaysOfWriting #AI #Ai #3DaysOfCode #websitedevelopment #WritingCommunity #BloggingCommunity #writerslift #coding #30DaysOfCode #code #Robotics #blog
jkelovuori,Latest data on smoking prevalence in the UK from the Annual Population Survey (APS) show an unrealistic drop in the proportion of adult cigarette smokers in 2020. This is likely affected by APS data collection changes resulting from the #COVID pandemic https://t.co/FgkqQhldUi https://t.co/AYFYYFGfl3
christo_tweets,let’s make Year Three of Covid the best one yet!!
LouisCarroll_95,"@British_Airways are Dubai accepting Covid 19 Recovery Certificates, given pre-departure PCR tests from UK can still show positive many weeks afterward. What’s the process here?"
SloughCouncil,"'While the COVID-19 vaccine may not stop you from getting COVID it will significantly reduce your chances of dying.'Follow Surgeon @DRJUDE__ as he gets his COVID-19 booster vaccine. If you're eligible for yours, book online today. https://t.co/qRqdKuCXTP https://t.co/EmVCFpEAvK"
wanda35945439,I’ve heard the same heart attack &amp; stroke story from nurses in my local hospital plus aggressive cancer increases...both new cancers and remission to suddenly spread throughout the body after COVID vaccine. It is not hard to understand why so many medical staff refuse the vaccine https://t.co/ORuUQ5A2Kc
mahin_afzal,"Glimpse of protest staged by @NSUIKarnataka members alongside 100s of pu students in front of PUC board, Bengaluru to cancel offline exams due to rising covid cases. #justiceforpustudents #cancelpuexams #NSUIwithStudents https://t.co/2UyrLt66H3"
ELetherby,Big moral outrage about lying and breaking covid rules from a man who conducted an eye exam with his kid strapped in the back on the A2 https://t.co/zSHlanHMS9
reveluvjoy11,"Mnet has decided to postpone the pre-recording performance for '2021 MAMA' due to SMTM10 staff tested positive Covid-19.According to original schedule, aespa's performance will have 450 k-MYs to be present today."
DCCPublicHealth,More people will soon be eligible for a #Covid19 booster. Find out more online here: https://t.co/oZFnQzsyFa https://t.co/PPLyfpdcci
sclehdorn,Lawyer for dying COVID patient who recovered after court-ordered Ivermectin urges new thinking | Just The News https://t.co/1ZBsDbudCo
C_hevelle9,Did people catch covid at Wizkid or are they ill from not wearing coats?
hulatt,Serco recently said its profits will be higher than expected in 2021 due to its Covid-related work including Test &amp; Trace.We need to kick the private companies out of Test &amp; Trace.And we need a Windfall Tax on the corporations that have made super-profits out of this crisis.
JosephTorre,This COVID test is unorthodox but I’m listening. https://t.co/lUWM6pSqXL
UthmanSamaai,You don't have a flu. You have Covid-19. Stay at home!!
nedsbluebayou,hey besties i straight up might have covid or some other bad sickness meaning ill have 3 tests to make up and if its covid my quarantine will feed into my exams meaning ill have to do them once break has started😃
CzerwonyKat,Greece is mandating the Covid vaccine for anyone aged 60 and over – or face a monthly 100 Euro fine from January. Greek Prime Minister @kmitsotakis tells me it’s led to “a significant uptick”: “I don’t like mandatory measures by nature but I feel it is the right decision”. https://t.co/4hbQu0OdcQ
abnheel,"This is a COVID test, made by Abbott.In Europe, it costs ~ $4.00.In the U.S., it costs ~ $25.00.COVID is big business, folks. https://t.co/6WH8sdOFV3"
SmyCraze,"According to Official investigation team Disha Salian PM done On 11th because of Covid -19 Then why #SushantSinghRajput PM performed by Cooper Hospital staff, exact at same night, without any Covid TestRises Question@ips_nupurprasad @DoPTGoI #JusticeForSushantSinghRajput"
Ursinos1,Common sense Covid-19 policy coming out of Madridhttps://t.co/PdLGZCe7O0
asianpeace_org,"India-Bangladesh ties remain stable, strong despite Covid: PM Hasinahttps://t.co/YbfC2M1bVP#india #bangladesh #PMHasina https://t.co/LCQtldsRx9"
Dunholme,"If we'd done nothing to control the spread of Covid then the cake would be much bigger, the Covid slice vastly bigger and the other slices most likely bigger too as hospitals would have been totally overwhelmed.But we still need to weigh the costs of lockdown in the equation. https://t.co/LpOvDwsxqY"
MSniscak,"If you have COVID and your employer forces you to work, report them to the CDC https://t.co/s6ox10YKce"
cutesybitsy,Blackpink’s Lisa makes her runway debut for Hedi Slimane’s Celine after recovering from COVID-19https://t.co/YIltzrFaFx
MumbaiNewsRT,"""The resident was comorbid patient and could not survive. 20 more of our residents are still taking treatment out of which four are in Intensive Care Unit""(report by @sajananambiar)https://t.co/DmepHWZJpP"
Marswaggo,saw someone complain that this is against covid protocol. what a time. https://t.co/XV9kIrsEA0
WilliamAntrim3,"“All fully vaxxed” 🤣🤣🤣🤣Cruise ship hell as Covid outbreak strikes vessel carrying 3,200 passengers https://t.co/kZQuPyZ6hu"
chriswadeevans,"If you want to talk about freedom, let’s talk about the freedom not to be infected on the basis of other people’s choices.Mask mandates in indoor public spaces while covid is spreading actually increase freedom for many people."
BThaboDitsele,"Anti-vaxxers are happy to get their babies vaccinated  against diseases, but turn around and talk about bodily integrity when it comes to COVID-19 vaccination. Who is fooling who here? @MandyWiener @Radio702"
CllrPatMarsh,"My Mum spent last Christmas on her own while my Dad was in hospital with covid, he didn’t last till New Year. She couldn’t say goodbye to him and I Couldn’t hug her at his funeral because of covid rules. All while the government partied. #WhoWasAtTheParty"
DropDownDeals,Watch live: WHO to speak on Omicron and Europe's COVID surgehttps://t.co/rs1mWso81t
njphlaz,"@drsajumathew As an EHS Manager of folks in 4 states &amp; multiple countries I can't tune COVID out.  It's my job to keep people safe.  I am also the person many loved ones count on to read the science &amp; help them stay safe. I'm exhausted, I want it over, but it's not. Thank you for your updates!"
jon_severs,"""Almost all children felt the impact of Covid-19 and the resulting restrictions to some extent.""Ofsted annual report re-iterates the need for some sort of plan from government for educational recovery beyond a broken tutoring programme. https://t.co/n7u5b6nHN4"
sthanubhardwaj,"My mother died during lockdown in 2020. Funeral took place under Covid restrictions. Attendees were father, brother, uncle and 2 RSS karyakartas. Uncle said: ""Your father was a lifelong communist yet not one @CPIMKerala worker turned up. Only @RSSorg, whom he hated, came to help"""
Sunsplashsun,"Just a reminder that my case of Covid was assessed to be *mild* and now I can’t live independently, can’t work and must rest before and after a shower. Please please please let’s not lose sight of the risks."
drahcirkram1964,@ActuaryByDay @ONS Appears those with significant health conditions aren’t being diagnosed or treated as they’d have historically anticipated. Suspect lockdown this and last year is killing more people than covid.
stewtgriffiths,This..................................Report Shows Nearly 300 Athletes Worldwide Collapsed or Suffered Cardiac Arrests after Taking COVID Vaccine This Year - Many Died https://t.co/kGMfBIMnXp via @gatewaypundit
St4rpower,Had the Moderna booster yesterday - the last 18 hours have been worse than a dose of full-blown Covid.
FreedomGeopol,People Get Microchips Implanted That Include Vaccine Records Amid New COVID Restrictions https://t.co/EOimUGeyl9
michelle1908,"We can slow the spread of COVID-19 by working together. Contact tracers &amp; local officials may call you for 2 reasons:1. If you have a positive COVID-19 test, or2. If you were in close contact with someone who tested positive.Don’t worry, these conversations are confidential. https://t.co/g7yxSXRDaV"
NickolaKalla,"I, myself, contracted Covid in April 2020 responding to emergency calls.We find ourselves in the position of raising funds to purchase much-needed medical equipment and supplies. 2/"
WizePenguin,"Kindly Be Advised that WORLD WIDE, presently MORE than 5,000,000 have DIED from Covid-19 &amp; weren't so fortunate as YOU MR. CREIGHTON, you heartless FAR RIGHT WING CUNT of a MAN! GET OMICRON &amp; just DIE, will YOU? https://t.co/PcTUlFASuR"
JONATHANBLUD,why are at-home covid test kit's not available here?
blondi777,@cryborg Clearly. DeSantis has been cooking the numbers since the beginning. I personally know of 3 covid deaths that were called natural causes.
shahin51945230,"@SmokersHelpline let's start a vitamin D campaign to stop heart attack &amp; stroke in winter.""Higher vitamin D levels in body greatly reduce risk of cancer, cardiovascular disease, diabetes, hypertension, autoimmune diseases, infectious diseases, and COVID-19"".Dr William B Grant PhD @wbgrant2"
amandajanewd,"@wyvernsrose I don’t think Mr 22 will ever move out 😂 Ms 28 has been living independently for a cple of years and has just moved in with BF and they’ve bought a house. Ms 20 just wants to go travelling so covid has been devastating, Mr 18 has no clue what he wants to do, Miss 11 rules roost"
Mlungu_Wajehova,@akrumxx @_trbwlsvm00 The new Covid variant must really be hectic https://t.co/4ctDCU8ShZ
kismettruth,"Just a reminder that my case of Covid was assessed to be *mild* and now I can’t live independently, can’t work and must rest before and after a shower. Please please please let’s not lose sight of the risks."
SPALAuto,"New regular monthly statistics are being published by @DfTstats showing overall chargepoint numbers in the UK. Only one line of figures so far - but it will quickly add up. Total of 27,614 devices including 5,088 rapids. Data from @zap_map https://t.co/iUoiYYxD2r"
_AliceDixon,"The government says “there was not a party” at No 10 last December and that no COVID rules were broken. A week into the story, this is a new 5-min video on the gap between the government’s assurances and available evidence. Produced by Michael Cox. https://t.co/cqIalvKKnB https://t.co/vWBxhOogI7"
ligayaa_forsb19,1) if money was no object and covid didn't exist where would you want to spend christmas?why?@SB19Official #STANWORLD #SB19Stream #Bazinga_SB19
iamgepic,"""My mother-in-law died because of lockdown. She died because her doctor couldn't be bothered to see her. We are killing people because of lockdown.""Broadcaster Tonia Buxton breaks down in tears as she reacts to the latest Covid restrictions.@iromg | @ToniaBuxton https://t.co/lfJX7Z3E1N"
swheeler69,"13,000 NHS operations cancelled in last two months at just 40 hospitals - The NHS capacity crisis is hitting care for thousands regularly   https://t.co/aB3SThnCK3"
C_hevelle9,"How can you go to a concert knowing you have covid, that’s so badmind"
NdubuisiMba1,@Reuters Its about time y'all experts/scientist admit it...Y'all are as confused as the information y'all are giving out about covid vax.A trial and error at best.😡
AnthonyT2_Mufc,@nadsshoes @PatricktheB @megafant1 @HaircutSpock @umfpt @SharkTooth787 @IngridIngwah @jools6691 @impeachqueen @michellmybell1 @reactiveIntent @wpcguy @tk_the_kitsune @DrSly16 @TheCOAPodcast @Bitcoinbabbi @LeannEAF @MucusMucous @MichaelSteidel @horusrage @p3driver @Truthwiththord @HeathenWombat @odktiger @bs_tolerance_0 @DanielJNickolas @bumpus_lumpus @ScientiaPercept @PeterFi98279139 @ei9iw @AboubakerSidiq @Omarmarketanci @BRijswijk @dyorotic2 @geraldpayne25 @Denbar64 @humeanskeptic76 @malo_j @DeanoMartino1 @C_82l @AntiCommy4ever @TheWestonMike @tklforgiven @GodflyThe @naughtmai @NelsonMKerr @Megavolt1 @patriot_1776US @elizabe34873526 @imkimaaron This is very simple. While people are getting the vaccines. Covid has still been spreading and killing. In countries that have vast majority vaccinated. Deaths are way down.
royymorah,“Wizkid Flu” ma’am that is covid
da_sweetthin,"Hi guys, @USEmbassyKenya will be hosting a Twitter space and a LIVE discussion on all things visas and COVID-19 vaccine travel information. Time : 6:30PM East African Time. https://t.co/H7w2T8Rus2"
mbili_braindoc2,When his cabinet announced their Covid-19 response https://t.co/yVWdbEeXRV
PlagueDoc1329,"@Dawson10G I currently have no choice in the matter, as mum still has covid so it's dad's job to do the drop off and pick up 😅 we are both negative and over it, mum caught it just as we got over it."
traceyfutures,"@dgmoore75 I was sleeping on a camp bed in a hospital Covid ward, looking after my Dad, after they gave him Covid in hospital. I wasn’t expecting that much of 2021 tbh."
LisaMarieWagner,It disgusts me to see pervert Matt Gaetz failing at fundraising whilst spreading dangerous Covid lies as he sits in Congress instead of seeing his arrest and expulsion for child sex trafficking and fraud.
gordyross,@anandsr21 @Sarahbsharpe @Loza7691 @JamesMelville @izeze1967 Of course I do but they could still have lived longer if they hadn't caught covid. Don't you understand that?
BarbHug45240937,PM accused of 'failure of leadership' after George Christensen calls for COVID protests at embassies https://t.co/ChlJGZvKwj
NeilLancefield,"Another day, another new set of rules for travellers. Hopefully I've answered any questions you might have here: https://t.co/89AbRTmesy"
KernowKoth,Obviously the genetic manipulation isn't for covid. It is for something else https://t.co/DLGawAZ4Fa
ILLDEFINEDPROMO,Would you support extending Covid passes to pubs and restaurants in Wales if the measure is announced at the next Welsh Government review on Friday?
bees_oz,For anyone reading this to be clear - Covid in children whether ‘mild’ or long covid can have unknown long term outcomes &amp; is best avoided. There is post inflammatory diseases that may occur after infection &amp; biological changes have recently been found after mild &amp; long covid.
no1rwest,New data shows GSK-Vir drug works against all Omicron mutationsBritish drugmaker GSK announced this morning that its antibody-based COVID-19 therapy with US partner Vir Biotechnology is effective against all mutations of the new Omicron coronavirus variant reports say 🇬🇧
mark_nze,Nobidy : Guess whose back 🤪Covid: yall know who it is
Patdetermined,Tomorrow the Health and Care Bill 2021 goes into HoL. Covid is a cover for dismantling health care. There has been no meaningful opposition from Labour front bench @Keir_Starmer or from @bma or from Royal Colleges. Time to oppose bill before it’s too late.
Felon82,"@SimplyStefario @AltuKop The same 1s in melt down over 6 players potentially being out with Covid, who face a Brighton side missing 8 of theirs...."
IamtheBM,"Beginning December 27th in New York City, 5 year old children (and older) will require at least one Covid jab to enter a restaurant.Insanity."
pamelahume14,Thank God for vaccine passportshttps://t.co/3z9436HdU5
KittenIncognito,"So these people must be dying of Covid then, right? https://t.co/6ExQKL4XNr"
Dernali1,"Just a reminder that my case of Covid was assessed to be *mild* and now I can’t live independently, can’t work and must rest before and after a shower. Please please please let’s not lose sight of the risks."
Tatimoreyra_,let’s make Year Three of Covid the best one yet!!
miguel95416966,"￼BREAKING:  One of Florida’s biggest hospital systems has ended all vaccine mandatesAdvent Health will no longer require its 83,000 employees to be vaccinated against Covid. https://t.co/GXKnEwteaZ"
